{
  "$schema": "./schema/hooks-catalog.schema.json",
  "name": "community",
  "description": "Community hook templates for the BB Hooks plugin: notifications, integrations, agent automation, and gate policies.",
  "version": "1.1.0",
  "homepage": "https://github.com/MacHatter1/bb-hooks-marketplace",
  "author": "MacHatter1",
  "templates": [
    {
      "id": "pushover",
      "name": "Pushover notification",
      "summary": "Push to your phone through Pushover.",
      "description": "Sends a Pushover push with the thread title and the last reply or error. Create an application at pushover.net to get an API token; your user key is on the dashboard. Both are stored encrypted.",
      "kind": "observe",
      "events": [
        "interaction.pending",
        "thread.failed"
      ],
      "tags": [
        "notifications",
        "phone",
        "push"
      ],
      "author": "MacHatter1",
      "version": "1.0.0",
      "params": [
        {
          "key": "token",
          "label": "Application token",
          "type": "string",
          "required": true,
          "secret": true
        },
        {
          "key": "user",
          "label": "User key",
          "type": "string",
          "required": true,
          "secret": true
        }
      ],
      "url": "https://api.pushover.net/1/messages.json",
      "body": "{\"token\":\"{{token}}\",\"user\":\"{{user}}\",\"title\":\"BB {{event}}\",\"message\":\"{{thread.title}}\\n{{lastAssistantText|300}}{{error|300}}\"}",
      "homepage": "https://github.com/MacHatter1/bb-hooks-marketplace"
    },
    {
      "id": "home-assistant",
      "name": "Home Assistant webhook",
      "summary": "Trigger a Home Assistant automation, for example turn a lamp red when an agent needs you.",
      "description": "Posts a small JSON payload to a Home Assistant webhook trigger. Create an automation with a Webhook trigger, copy its URL, and use the event field in your automation's conditions (interaction.pending, thread.idle, \u2026).",
      "kind": "observe",
      "events": [
        "interaction.pending",
        "thread.idle"
      ],
      "tags": [
        "integration",
        "home-automation"
      ],
      "author": "MacHatter1",
      "version": "1.0.0",
      "params": [
        {
          "key": "webhookUrl",
          "label": "Webhook URL",
          "description": "https://<your-ha>/api/webhook/<id>",
          "type": "string",
          "required": true,
          "secret": true
        }
      ],
      "url": "{{webhookUrl}}",
      "body": "{\"event\":\"{{event}}\",\"thread\":\"{{thread.title}}\",\"threadId\":\"{{thread.id}}\",\"status\":\"{{thread.status}}\"}",
      "homepage": "https://github.com/MacHatter1/bb-hooks-marketplace"
    },
    {
      "id": "pagerduty",
      "name": "PagerDuty alert",
      "summary": "Trigger a PagerDuty incident when a thread or turn fails.",
      "description": "Uses the PagerDuty Events API v2 with an Events integration routing key. Incidents are deduplicated per thread. Severity is one of critical, error, warning, info.",
      "kind": "observe",
      "events": [
        "thread.failed",
        "turn.failed"
      ],
      "tags": [
        "notifications",
        "on-call",
        "pagerduty"
      ],
      "author": "MacHatter1",
      "version": "1.0.0",
      "params": [
        {
          "key": "routingKey",
          "label": "Integration routing key",
          "type": "string",
          "required": true,
          "secret": true
        },
        {
          "key": "severity",
          "label": "Severity",
          "description": "critical, error, warning or info",
          "type": "string",
          "default": "warning"
        }
      ],
      "url": "https://events.pagerduty.com/v2/enqueue",
      "body": "{\"routing_key\":\"{{routingKey}}\",\"event_action\":\"trigger\",\"dedup_key\":\"bb-{{thread.id}}\",\"payload\":{\"summary\":\"BB {{event}}: {{thread.title}}\",\"severity\":\"{{severity}}\",\"source\":\"bb\",\"custom_details\":{\"threadId\":\"{{thread.id}}\",\"error\":\"{{error|500}}\"}}}",
      "homepage": "https://github.com/MacHatter1/bb-hooks-marketplace"
    },
    {
      "id": "teams",
      "name": "Microsoft Teams message",
      "summary": "Post to a Teams channel through an incoming webhook or workflow URL.",
      "kind": "observe",
      "events": [
        "thread.idle",
        "thread.failed",
        "interaction.pending"
      ],
      "tags": [
        "notifications",
        "chat",
        "teams"
      ],
      "author": "MacHatter1",
      "version": "1.0.0",
      "params": [
        {
          "key": "webhookUrl",
          "label": "Incoming webhook URL",
          "type": "string",
          "required": true,
          "secret": true
        }
      ],
      "url": "{{webhookUrl}}",
      "body": "{\"text\":\"BB {{event}} \u2014 {{thread.title}}\\n{{lastAssistantText|500}}{{error|500}}\"}",
      "homepage": "https://github.com/MacHatter1/bb-hooks-marketplace"
    },
    {
      "id": "mattermost",
      "name": "Mattermost message",
      "summary": "Post to a Mattermost channel through an incoming webhook.",
      "kind": "observe",
      "events": [
        "thread.idle",
        "thread.failed",
        "interaction.pending"
      ],
      "tags": [
        "notifications",
        "chat",
        "mattermost"
      ],
      "author": "MacHatter1",
      "version": "1.0.0",
      "params": [
        {
          "key": "webhookUrl",
          "label": "Incoming webhook URL",
          "type": "string",
          "required": true,
          "secret": true
        }
      ],
      "url": "{{webhookUrl}}",
      "body": "{\"text\":\"BB {{event}} \u2014 {{thread.title}}\\n{{lastAssistantText|500}}{{error|500}}\"}",
      "homepage": "https://github.com/MacHatter1/bb-hooks-marketplace"
    },
    {
      "id": "resend-email",
      "name": "Email via Resend",
      "summary": "Email yourself the result or error of a thread through the Resend API.",
      "description": "Sends a plain-text email with the last assistant reply or the error. Needs a Resend API key and a verified sender. The key is sent as a bearer token and stored encrypted.",
      "kind": "observe",
      "events": [
        "thread.idle",
        "thread.failed"
      ],
      "tags": [
        "notifications",
        "email"
      ],
      "author": "MacHatter1",
      "version": "1.0.0",
      "params": [
        {
          "key": "apiKey",
          "label": "Resend API key",
          "type": "string",
          "required": true,
          "secret": true
        },
        {
          "key": "from",
          "label": "From address",
          "description": "A sender on a domain verified in Resend.",
          "type": "string",
          "required": true
        },
        {
          "key": "to",
          "label": "To address",
          "type": "string",
          "required": true
        }
      ],
      "url": "https://api.resend.com/emails",
      "headers": {
        "authorization": "Bearer {{apiKey}}"
      },
      "body": "{\"from\":\"{{from}}\",\"to\":[\"{{to}}\"],\"subject\":\"BB {{event}}: {{thread.title}}\",\"text\":\"{{lastAssistantText|4000}}{{error|4000}}\\n\\nThread {{thread.id}}\"}",
      "homepage": "https://github.com/MacHatter1/bb-hooks-marketplace"
    },
    {
      "id": "github-issue-comment",
      "name": "Comment on the linked GitHub issue",
      "summary": "When a thread whose title mentions #123 finishes, post its output as a comment on issue 123.",
      "description": "Extracts the first #number from the thread title and posts the thread's final output as an issue comment with the gh CLI. Threads without a #number are ignored.",
      "kind": "observe",
      "events": [
        "thread.idle"
      ],
      "tags": [
        "integration",
        "github",
        "automation"
      ],
      "author": "MacHatter1",
      "version": "1.0.0",
      "params": [
        {
          "key": "repo",
          "label": "Repository (owner/name)",
          "type": "string",
          "required": true
        }
      ],
      "command": "repo={{repo}}\nn=$(printf '%s' \"$BB_THREAD_TITLE\" | sed -n 's/.*#\\([0-9][0-9]*\\).*/\\1/p' | head -n 1)\n[ -z \"$n\" ] && exit 0\nbody=$(\"${BB_CLI:-bb}\" thread output \"$BB_THREAD_ID\" 2>/dev/null | head -c 60000)\n[ -z \"$body\" ] && exit 0\nprintf '%s\\n\\n_Posted by BB hooks from thread %s._\\n' \"$body\" \"$BB_THREAD_ID\" | gh issue comment \"$n\" -R \"$repo\" --body-file -",
      "timeoutMs": 60000,
      "notes": "Needs the gh CLI authenticated on the machine running the BB server.",
      "homepage": "https://github.com/MacHatter1/bb-hooks-marketplace"
    },
    {
      "id": "archive-when-done",
      "name": "Archive finished threads",
      "summary": "Archive a thread as soon as it goes idle. Scope it with a title filter so only throwaway threads are archived.",
      "kind": "observe",
      "events": [
        "thread.idle"
      ],
      "tags": [
        "automation",
        "housekeeping"
      ],
      "author": "MacHatter1",
      "version": "1.0.0",
      "params": [],
      "command": "\"${BB_CLI:-bb}\" thread archive \"$BB_THREAD_ID\"",
      "notes": "Combine with --title '^chore' or a project filter. Archived threads can be unarchived from the sidebar.",
      "homepage": "https://github.com/MacHatter1/bb-hooks-marketplace"
    },
    {
      "id": "failover",
      "name": "Provider failover on rate limits",
      "summary": "When a turn fails because the provider is rate limited, re-run the same prompt on another provider.",
      "description": "Listens to turn.failed, checks that the failure is a rate limit, fetches the thread's latest prompt, and spawns a new thread on the agent you choose in the same workspace, parented to the failed thread. Only top-level threads trigger it, so it never loops.",
      "kind": "observe",
      "events": [
        "turn.failed"
      ],